"No.","Time","Source","Destination","Protocol","Length","Info"
"1","0.000000000","10.0.2.15","162.159.200.1","NTP","90","NTP Version 4, client"
"2","0.032373819","162.159.200.1","10.0.2.15","NTP","90","NTP Version 4, server"
"3","16.553472836","10.0.2.15","10.0.2.3","DNS","89","Standard query 0xfb45 A location.services.mozilla.com"
"4","16.553928808","10.0.2.15","10.0.2.3","DNS","89","Standard query 0x1846 AAAA location.services.mozilla.com"
"5","16.637855262","10.0.2.3","10.0.2.15","DNS","141","Standard query response 0xfb45 A location.services.mozilla.com CNAME mozilla.map.fastly.net A 151.101.105.91"
"6","16.644584284","10.0.2.3","10.0.2.15","DNS","153","Standard query response 0x1846 AAAA location.services.mozilla.com CNAME mozilla.map.fastly.net AAAA 2a04:4e42:19::347"
"7","16.645017937","10.0.2.15","151.101.105.91","TCP","74","40514  >  443 [SYN] Seq=0 Win=64240 Len=0 MSS=1460 SACK_PERM TSval=482142314 TSecr=0 WS=512"
"8","16.707724224","151.101.105.91","10.0.2.15","TCP","60","443  >  40514 [SYN, ACK] Seq=0 Ack=1 Win=65535 Len=0 MSS=1460"
"9","16.707770267","10.0.2.15","151.101.105.91","TCP","54","40514  >  443 [ACK] Seq=1 Ack=1 Win=64240 Len=0"
"10","16.709492300","10.0.2.15","151.101.105.91","TLSv1.3","1968","Client Hello (SNI=location.services.mozilla.com)"
"11","16.711618121","151.101.105.91","10.0.2.15","TCP","60","443  >  40514 [ACK] Seq=1 Ack=1461 Win=65535 Len=0"
"12","16.711618412","151.101.105.91","10.0.2.15","TCP","60","443  >  40514 [ACK] Seq=1 Ack=1915 Win=65535 Len=0"
"13","16.761850678","151.101.105.91","10.0.2.15","TLSv1.3","1354","Server Hello, Change Cipher Spec, Application Data"
"14","16.761851029","151.101.105.91","10.0.2.15","TCP","1494","443  >  40514 [ACK] Seq=1301 Ack=1915 Win=65535 Len=1440 [TCP PDU reassembled in 17]"
"15","16.761948245","10.0.2.15","151.101.105.91","TCP","54","40514  >  443 [ACK] Seq=1915 Ack=1301 Win=65535 Len=0"
"16","16.762012422","10.0.2.15","151.101.105.91","TCP","54","40514  >  443 [ACK] Seq=1915 Ack=2741 Win=65535 Len=0"
"17","16.763977808","151.101.105.91","10.0.2.15","TLSv1.3","1821","Application Data, Application Data, Application Data, Application Data"
"18","16.763993862","10.0.2.15","151.101.105.91","TCP","54","40514  >  443 [ACK] Seq=1915 Ack=4508 Win=65535 Len=0"
"19","16.773226796","10.0.2.15","151.101.105.91","TLSv1.3","118","Change Cipher Spec, Application Data"
"20","16.773583376","151.101.105.91","10.0.2.15","TCP","60","443  >  40514 [ACK] Seq=4508 Ack=1979 Win=65535 Len=0"
"21","16.774755510","10.0.2.15","151.101.105.91","TLSv1.3","146","Application Data"
"22","16.775046444","151.101.105.91","10.0.2.15","TCP","60","443  >  40514 [ACK] Seq=4508 Ack=2071 Win=65535 Len=0"
"23","16.775146647","10.0.2.15","151.101.105.91","TLSv1.3","297","Application Data"
"24","16.775435398","151.101.105.91","10.0.2.15","TCP","60","443  >  40514 [ACK] Seq=4508 Ack=2314 Win=65535 Len=0"
"25","16.822162147","151.101.105.91","10.0.2.15","TLSv1.3","119","Application Data"
"26","16.830917169","10.0.2.15","151.101.105.91","TLSv1.3","85","Application Data"
"27","16.833647171","151.101.105.91","10.0.2.15","TCP","60","443  >  40514 [ACK] Seq=4573 Ack=2345 Win=65535 Len=0"
"28","17.057015598","10.0.2.15","10.0.2.3","DNS","97","Standard query 0x0850 A firefox.settings.services.mozilla.com"
"29","17.057377259","10.0.2.15","10.0.2.3","DNS","97","Standard query 0x8f51 AAAA firefox.settings.services.mozilla.com"
"30","17.067980720","151.101.105.91","10.0.2.15","TLSv1.3","417","Application Data, Application Data"
"31","17.113576262","10.0.2.15","151.101.105.91","TCP","54","40514  >  443 [ACK] Seq=2345 Ack=4936 Win=65535 Len=0"
"32","17.122739984","10.0.2.3","10.0.2.15","DNS","149","Standard query response 0x0850 A firefox.settings.services.mozilla.com CNAME mozilla.map.fastly.net A 151.101.105.91"
"33","17.122740430","10.0.2.3","10.0.2.15","DNS","161","Standard query response 0x8f51 AAAA firefox.settings.services.mozilla.com CNAME mozilla.map.fastly.net AAAA 2a04:4e42:19::347"
"34","17.124420582","10.0.2.15","151.101.105.91","TCP","74","40522  >  443 [SYN] Seq=0 Win=64240 Len=0 MSS=1460 SACK_PERM TSval=482142794 TSecr=0 WS=512"
"35","17.165382098","151.101.105.91","10.0.2.15","TCP","60","443  >  40522 [SYN, ACK] Seq=0 Ack=1 Win=65535 Len=0 MSS=1460"
"36","17.165435319","10.0.2.15","151.101.105.91","TCP","54","40522  >  443 [ACK] Seq=1 Ack=1 Win=64240 Len=0"
"37","17.166873903","10.0.2.15","151.101.105.91","TLSv1.2","276","Client Hello (SNI=firefox.settings.services.mozilla.com)"
"38","17.167588960","151.101.105.91","10.0.2.15","TCP","60","443  >  40522 [ACK] Seq=1 Ack=223 Win=65535 Len=0"
"39","17.209560299","151.101.105.91","10.0.2.15","TLSv1.2","1354","Server Hello"
"40","17.209560738","151.101.105.91","10.0.2.15","TCP","1494","443  >  40522 [ACK] Seq=1301 Ack=223 Win=65535 Len=1440 [TCP PDU reassembled in 43]"
"41","17.209641074","10.0.2.15","151.101.105.91","TCP","54","40522  >  443 [ACK] Seq=223 Ack=1301 Win=65535 Len=0"
"42","17.209735354","10.0.2.15","151.101.105.91","TCP","54","40522  >  443 [ACK] Seq=223 Ack=2741 Win=65535 Len=0"
"43","17.223496098","151.101.105.91","10.0.2.15","TLSv1.2","376","Certificate, Server Key Exchange, Server Hello Done"
"44","17.223601392","10.0.2.15","151.101.105.91","TCP","54","40522  >  443 [ACK] Seq=223 Ack=3063 Win=65535 Len=0"
"45","17.227466758","10.0.2.15","151.101.105.91","TLSv1.2","147","Client Key Exchange, Change Cipher Spec, Encrypted Handshake Message"
"46","17.228019661","151.101.105.91","10.0.2.15","TCP","60","443  >  40522 [ACK] Seq=3063 Ack=316 Win=65535 Len=0"
"47","17.283862935","151.101.105.91","10.0.2.15","TLSv1.2","312","New Session Ticket, Change Cipher Spec, Encrypted Handshake Message"
"48","17.288135327","10.0.2.15","151.101.105.91","TLSv1.2","153","Application Data"
"49","17.290732025","10.0.2.15","151.101.105.91","TLSv1.2","249","Application Data"
"50","17.291376292","151.101.105.91","10.0.2.15","TCP","60","443  >  40522 [ACK] Seq=3321 Ack=415 Win=65535 Len=0"
"51","17.291376870","151.101.105.91","10.0.2.15","TCP","60","443  >  40522 [ACK] Seq=3321 Ack=610 Win=65535 Len=0"
"52","17.345717268","151.101.105.91","10.0.2.15","TLSv1.2","126","Application Data"
"53","17.345717618","151.101.105.91","10.0.2.15","TLSv1.2","1161","Application Data, Application Data"
"54","17.345966991","10.0.2.15","151.101.105.91","TLSv1.2","92","Application Data"
"55","17.348500956","151.101.105.91","10.0.2.15","TCP","60","443  >  40522 [ACK] Seq=4500 Ack=648 Win=65535 Len=0"
"56","18.086482598","10.0.2.15","10.0.2.3","DNS","104","Standard query 0x5e8e A firefox-settings-attachments.cdn.mozilla.net"
"57","18.086886299","10.0.2.15","10.0.2.3","DNS","104","Standard query 0xcf8c AAAA firefox-settings-attachments.cdn.mozilla.net"
"58","18.225084331","10.0.2.15","10.0.2.3","DNS","75","Standard query 0x96e5 A ads.mozilla.org"
"59","18.225431278","10.0.2.15","10.0.2.3","DNS","75","Standard query 0xf4db AAAA ads.mozilla.org"
"60","18.234018493","10.0.2.3","10.0.2.15","DNS","153","Standard query response 0x5e8e A firefox-settings-attachments.cdn.mozilla.net CNAME mozilla.map.fastly.net A 151.101.105.91"
"61","18.234018792","10.0.2.3","10.0.2.15","DNS","165","Standard query response 0xcf8c AAAA firefox-settings-attachments.cdn.mozilla.net CNAME mozilla.map.fastly.net AAAA 2a04:4e42:19::347"
"62","18.236186160","10.0.2.15","151.101.105.91","TCP","74","40532  >  443 [SYN] Seq=0 Win=64240 Len=0 MSS=1460 SACK_PERM TSval=482143905 TSecr=0 WS=512"
"63","18.253152186","10.0.2.3","10.0.2.15","DNS","127","Standard query response 0x96e5 A ads.mozilla.org CNAME mozilla.map.fastly.net A 151.101.105.91"
"64","18.253152546","10.0.2.3","10.0.2.15","DNS","139","Standard query response 0xf4db AAAA ads.mozilla.org CNAME mozilla.map.fastly.net AAAA 2a04:4e42:19::347"
"65","18.254546172","10.0.2.15","151.101.105.91","TCP","74","40538  >  443 [SYN] Seq=0 Win=64240 Len=0 MSS=1460 SACK_PERM TSval=482143924 TSecr=0 WS=512"
"66","18.267839531","151.101.105.91","10.0.2.15","TCP","60","443  >  40532 [SYN, ACK] Seq=0 Ack=1 Win=65535 Len=0 MSS=1460"
"67","18.267899802","10.0.2.15","151.101.105.91","TCP","54","40532  >  443 [ACK] Seq=1 Ack=1 Win=64240 Len=0"
"68","18.268156559","10.0.2.15","151.101.105.91","TLSv1.2","283","Client Hello (SNI=firefox-settings-attachments.cdn.mozilla.net)"
"69","18.268661919","151.101.105.91","10.0.2.15","TCP","60","443  >  40532 [ACK] Seq=1 Ack=230 Win=65535 Len=0"
"70","18.314222889","151.101.105.91","10.0.2.15","TCP","60","443  >  40538 [SYN, ACK] Seq=0 Ack=1 Win=65535 Len=0 MSS=1460"
"71","18.314295355","10.0.2.15","151.101.105.91","TCP","54","40538  >  443 [ACK] Seq=1 Ack=1 Win=64240 Len=0"
"72","18.315560192","10.0.2.15","151.101.105.91","TLSv1.3","1954","Client Hello (SNI=ads.mozilla.org)"
"73","18.315988372","151.101.105.91","10.0.2.15","TCP","60","443  >  40538 [ACK] Seq=1 Ack=1461 Win=65535 Len=0"
"74","18.315988612","151.101.105.91","10.0.2.15","TCP","60","443  >  40538 [ACK] Seq=1 Ack=1901 Win=65535 Len=0"
"75","18.325279156","151.101.105.91","10.0.2.15","TLSv1.2","1354","Server Hello"
"76","18.325280319","151.101.105.91","10.0.2.15","TCP","1494","443  >  40532 [ACK] Seq=1301 Ack=230 Win=65535 Len=1440 [TCP PDU reassembled in 79]"
"77","18.325406528","10.0.2.15","151.101.105.91","TCP","54","40532  >  443 [ACK] Seq=230 Ack=1301 Win=65535 Len=0"
"78","18.325623702","10.0.2.15","151.101.105.91","TCP","54","40532  >  443 [ACK] Seq=230 Ack=2741 Win=65535 Len=0"
"79","18.326050688","151.101.105.91","10.0.2.15","TLSv1.2","401","Certificate, Server Key Exchange, Server Hello Done"
"80","18.326058364","10.0.2.15","151.101.105.91","TCP","54","40532  >  443 [ACK] Seq=230 Ack=3088 Win=65535 Len=0"
"81","18.327526644","10.0.2.15","151.101.105.91","TLSv1.2","147","Client Key Exchange, Change Cipher Spec, Encrypted Handshake Message"
"82","18.328252400","151.101.105.91","10.0.2.15","TCP","60","443  >  40532 [ACK] Seq=3088 Ack=323 Win=65535 Len=0"
"83","18.369591712","151.101.105.91","10.0.2.15","TLSv1.2","312","New Session Ticket, Change Cipher Spec, Encrypted Handshake Message"
"84","18.369592099","151.101.105.91","10.0.2.15","TLSv1.3","2654","Server Hello, Change Cipher Spec, Application Data"
"85","18.369631623","10.0.2.15","151.101.105.91","TCP","54","40538  >  443 [ACK] Seq=1901 Ack=2601 Win=65535 Len=0"
"86","18.370241095","151.101.105.91","10.0.2.15","TLSv1.3","1985","Application Data, Application Data, Application Data, Application Data"
"87","18.370252604","10.0.2.15","151.101.105.91","TCP","54","40538  >  443 [ACK] Seq=1901 Ack=4532 Win=65535 Len=0"
"88","18.376811909","10.0.2.15","151.101.105.91","TLSv1.2","153","Application Data"
"89","18.377205801","10.0.2.15","151.101.105.91","TLSv1.2","272","Application Data"
"90","18.377419125","151.101.105.91","10.0.2.15","TCP","60","443  >  40532 [ACK] Seq=3346 Ack=640 Win=65535 Len=0"
"91","18.397171805","10.0.2.15","151.101.105.91","TLSv1.3","118","Change Cipher Spec, Application Data"
"92","18.397549759","151.101.105.91","10.0.2.15","TCP","60","443  >  40538 [ACK] Seq=4532 Ack=1965 Win=65535 Len=0"
"93","18.398159893","10.0.2.15","151.101.105.91","TLSv1.3","146","Application Data"
"94","18.398493588","10.0.2.15","151.101.105.91","TLSv1.3","258","Application Data"
"95","18.398775060","151.101.105.91","10.0.2.15","TCP","60","443  >  40538 [ACK] Seq=4532 Ack=2057 Win=65535 Len=0"
"96","18.398775305","151.101.105.91","10.0.2.15","TCP","60","443  >  40538 [ACK] Seq=4532 Ack=2261 Win=65535 Len=0"
"97","18.407966921","10.0.2.15","151.101.105.91","TLSv1.3","310","Application Data"
"98","18.408667705","151.101.105.91","10.0.2.15","TCP","60","443  >  40538 [ACK] Seq=4532 Ack=2517 Win=65535 Len=0"
"99","18.422257223","151.101.105.91","10.0.2.15","TLSv1.2","713","Application Data, Application Data"
"100","18.422258239","151.101.105.91","10.0.2.15","TCP","5254","443  >  40532 [PSH, ACK] Seq=4005 Ack=640 Win=65535 Len=5200 [TCP PDU reassembled in 110]"
"101","18.422258282","151.101.105.91","10.0.2.15","TCP","2654","443  >  40532 [PSH, ACK] Seq=9205 Ack=640 Win=65535 Len=2600 [TCP PDU reassembled in 110]"
"102","18.422344528","10.0.2.15","151.101.105.91","TCP","54","40532  >  443 [ACK] Seq=640 Ack=9205 Win=65535 Len=0"
"103","18.422689063","151.101.105.91","10.0.2.15","TCP","5254","443  >  40532 [PSH, ACK] Seq=11805 Ack=640 Win=65535 Len=5200 [TCP PDU reassembled in 110]"
"104","18.423354013","10.0.2.15","151.101.105.91","TCP","54","40532  >  443 [ACK] Seq=640 Ack=17005 Win=65535 Len=0"
"105","18.423987554","10.0.2.15","151.101.105.91","TLSv1.2","92","Application Data"
"106","18.424380149","151.101.105.91","10.0.2.15","TCP","60","443  >  40532 [ACK] Seq=17005 Ack=678 Win=65535 Len=0"
"107","18.425125917","151.101.105.91","10.0.2.15","TCP","1354","443  >  40532 [PSH, ACK] Seq=17005 Ack=678 Win=65535 Len=1300 [TCP PDU reassembled in 110]"
"108","18.425126261","151.101.105.91","10.0.2.15","TCP","1354","443  >  40532 [PSH, ACK] Seq=18305 Ack=678 Win=65535 Len=1300 [TCP PDU reassembled in 110]"
"109","18.430169823","10.0.2.15","151.101.105.91","TCP","54","40532  >  443 [ACK] Seq=678 Ack=19605 Win=65535 Len=0"
"110","18.431094414","151.101.105.91","10.0.2.15","TLSv1.2","1354","Application Data"
"111","18.431094744","151.101.105.91","10.0.2.15","TCP","1354","443  >  40532 [PSH, ACK] Seq=20905 Ack=678 Win=65535 Len=1300 [TCP PDU reassembled in 124]"
"112","18.431094791","151.101.105.91","10.0.2.15","TCP","1354","443  >  40532 [PSH, ACK] Seq=22205 Ack=678 Win=65535 Len=1300 [TCP PDU reassembled in 124]"
"113","18.431094817","151.101.105.91","10.0.2.15","TCP","1354","443  >  40532 [PSH, ACK] Seq=23505 Ack=678 Win=65535 Len=1300 [TCP PDU reassembled in 124]"
"114","18.431094847","151.101.105.91","10.0.2.15","TCP","1354","443  >  40532 [PSH, ACK] Seq=24805 Ack=678 Win=65535 Len=1300 [TCP PDU reassembled in 124]"
"115","18.431094866","151.101.105.91","10.0.2.15","TCP","1354","443  >  40532 [PSH, ACK] Seq=26105 Ack=678 Win=65535 Len=1300 [TCP PDU reassembled in 124]"
"116","18.431094884","151.101.105.91","10.0.2.15","TCP","1354","443  >  40532 [PSH, ACK] Seq=27405 Ack=678 Win=65535 Len=1300 [TCP PDU reassembled in 124]"
"117","18.431122884","10.0.2.15","151.101.105.91","TCP","54","40532  >  443 [ACK] Seq=678 Ack=22205 Win=65535 Len=0"
"118","18.432733974","151.101.105.91","10.0.2.15","TCP","1354","443  >  40532 [PSH, ACK] Seq=28705 Ack=678 Win=65535 Len=1300 [TCP PDU reassembled in 124]"
"119","18.432734369","151.101.105.91","10.0.2.15","TCP","1354","443  >  40532 [PSH, ACK] Seq=30005 Ack=678 Win=65535 Len=1300 [TCP PDU reassembled in 124]"
"120","18.432734390","151.101.105.91","10.0.2.15","TCP","1354","443  >  40532 [PSH, ACK] Seq=31305 Ack=678 Win=65535 Len=1300 [TCP PDU reassembled in 124]"
"121","18.434175397","151.101.105.91","10.0.2.15","TCP","1354","443  >  40532 [PSH, ACK] Seq=32605 Ack=678 Win=65535 Len=1300 [TCP PDU reassembled in 124]"
"122","18.434175603","151.101.105.91","10.0.2.15","TCP","2654","443  >  40532 [PSH, ACK] Seq=33905 Ack=678 Win=65535 Len=2600 [TCP PDU reassembled in 124]"
"123","18.440258976","10.0.2.15","151.101.105.91","TCP","54","40532  >  443 [ACK] Seq=678 Ack=36505 Win=65535 Len=0"
"124","18.440794943","151.101.105.91","10.0.2.15","TLSv1.2","3954","Application Data"
"125","18.440966036","10.0.2.15","151.101.105.91","TCP","54","40532  >  443 [ACK] Seq=678 Ack=40405 Win=65000 Len=0"
"126","18.441478067","151.101.105.91","10.0.2.15","TLSv1.3","119","Application Data"
"127","18.441581519","10.0.2.15","151.101.105.91","TLSv1.3","85","Application Data"
"128","18.444806188","151.101.105.91","10.0.2.15","TCP","60","443  >  40538 [ACK] Seq=4597 Ack=2548 Win=65535 Len=0"
"129","18.457102151","151.101.105.91","10.0.2.15","TCP","1354","443  >  40532 [PSH, ACK] Seq=40405 Ack=678 Win=65535 Len=1300 [TCP PDU reassembled in 135]"
"130","18.461541324","151.101.105.91","10.0.2.15","TCP","1354","443  >  40532 [PSH, ACK] Seq=41705 Ack=678 Win=65535 Len=1300 [TCP PDU reassembled in 135]"
"131","18.461541689","151.101.105.91","10.0.2.15","TCP","5254","443  >  40532 [PSH, ACK] Seq=43005 Ack=678 Win=65535 Len=5200 [TCP PDU reassembled in 135]"
"132","18.461541727","151.101.105.91","10.0.2.15","TCP","2654","443  >  40532 [PSH, ACK] Seq=48205 Ack=678 Win=65535 Len=2600 [TCP PDU reassembled in 135]"
"133","18.461573511","10.0.2.15","151.101.105.91","TCP","54","40532  >  443 [ACK] Seq=678 Ack=43005 Win=65535 Len=0"
"134","18.461991867","151.101.105.91","10.0.2.15","TCP","1354","443  >  40532 [PSH, ACK] Seq=50805 Ack=678 Win=65535 Len=1300 [TCP PDU reassembled in 135]"
"135","18.464719440","151.101.105.91","10.0.2.15","TLSv1.2","1354","Application Data"
"136","18.464719823","151.101.105.91","10.0.2.15","TCP","3954","443  >  40532 [PSH, ACK] Seq=53405 Ack=678 Win=65535 Len=3900 [TCP PDU reassembled in 141]"
"137","18.464719842","151.101.105.91","10.0.2.15","TCP","2654","443  >  40532 [PSH, ACK] Seq=57305 Ack=678 Win=65535 Len=2600 [TCP PDU reassembled in 141]"
"138","18.465380932","151.101.105.91","10.0.2.15","TCP","1354","443  >  40532 [PSH, ACK] Seq=59905 Ack=678 Win=65535 Len=1300 [TCP PDU reassembled in 141]"
"139","18.473316953","10.0.2.15","151.101.105.91","TCP","54","40532  >  443 [ACK] Seq=678 Ack=61205 Win=64800 Len=0"
"140","18.473677104","151.101.105.91","10.0.2.15","TCP","2934","443  >  40532 [ACK] Seq=61205 Ack=678 Win=65535 Len=2880 [TCP PDU reassembled in 141]"
"141","18.473909929","151.101.105.91","10.0.2.15","TLSv1.2","12774","Application Data, Application Data"
"142","18.474068857","10.0.2.15","151.101.105.91","TCP","54","40532  >  443 [ACK] Seq=678 Ack=76805 Win=65535 Len=0"
"143","18.474644024","151.101.105.91","10.0.2.15","TCP","3954","443  >  40532 [PSH, ACK] Seq=76805 Ack=678 Win=65535 Len=3900 [TCP PDU reassembled in 148]"
"144","18.474644171","151.101.105.91","10.0.2.15","TCP","1354","443  >  40532 [PSH, ACK] Seq=80705 Ack=678 Win=65535 Len=1300 [TCP PDU reassembled in 148]"
"145","18.474644198","151.101.105.91","10.0.2.15","TCP","3954","443  >  40532 [PSH, ACK] Seq=82005 Ack=678 Win=65535 Len=3900 [TCP PDU reassembled in 148]"
"146","18.474657852","10.0.2.15","151.101.105.91","TCP","54","40532  >  443 [ACK] Seq=678 Ack=80705 Win=65535 Len=0"
"147","18.474708032","10.0.2.15","151.101.105.91","TCP","54","40532  >  443 [ACK] Seq=678 Ack=85905 Win=65535 Len=0"
"148","18.475340265","151.101.105.91","10.0.2.15","TLSv1.2","3954","Application Data"
"149","18.475340411","151.101.105.91","10.0.2.15","TCP","1354","443  >  40532 [PSH, ACK] Seq=89805 Ack=678 Win=65535 Len=1300 [TCP PDU reassembled in 155]"
"150","18.475351360","10.0.2.15","151.101.105.91","TCP","54","40532  >  443 [ACK] Seq=678 Ack=89805 Win=65535 Len=0"
"151","18.479206366","151.101.105.91","10.0.2.15","TCP","6554","443  >  40532 [PSH, ACK] Seq=91105 Ack=678 Win=65535 Len=6500 [TCP PDU reassembled in 155]"
"152","18.479232055","10.0.2.15","151.101.105.91","TCP","54","40532  >  443 [ACK] Seq=678 Ack=97605 Win=65535 Len=0"
"153","18.479969800","151.101.105.91","10.0.2.15","TCP","2654","443  >  40532 [PSH, ACK] Seq=97605 Ack=678 Win=65535 Len=2600 [TCP PDU reassembled in 155]"
"154","18.479969974","151.101.105.91","10.0.2.15","TCP","1354","443  >  40532 [PSH, ACK] Seq=100205 Ack=678 Win=65535 Len=1300 [TCP PDU reassembled in 155]"
"155","18.479970024","151.101.105.91","10.0.2.15","TLSv1.2","1354","Application Data"
"156","18.479970049","151.101.105.91","10.0.2.15","TCP","1354","443  >  40532 [PSH, ACK] Seq=102805 Ack=678 Win=65535 Len=1300 [TCP PDU reassembled in 175]"
"157","18.479970069","151.101.105.91","10.0.2.15","TCP","1354","443  >  40532 [PSH, ACK] Seq=104105 Ack=678 Win=65535 Len=1300 [TCP PDU reassembled in 175]"
"158","18.480003175","10.0.2.15","151.101.105.91","TCP","54","40532  >  443 [ACK] Seq=678 Ack=100205 Win=65535 Len=0"
"159","18.480094398","10.0.2.15","151.101.105.91","TCP","54","40532  >  443 [ACK] Seq=678 Ack=102805 Win=65535 Len=0"
"160","18.480153552","10.0.2.15","151.101.105.91","TCP","54","40532  >  443 [ACK] Seq=678 Ack=105405 Win=65535 Len=0"
"161","18.492004933","151.101.105.91","10.0.2.15","TCP","1354","443  >  40532 [PSH, ACK] Seq=105405 Ack=678 Win=65535 Len=1300 [TCP PDU reassembled in 175]"
"162","18.492005393","151.101.105.91","10.0.2.15","TCP","334","443  >  40532 [PSH, ACK] Seq=106705 Ack=678 Win=65535 Len=280 [TCP PDU reassembled in 175]"
"163","18.492042412","10.0.2.15","151.101.105.91","TCP","54","40532  >  443 [ACK] Seq=678 Ack=106985 Win=65535 Len=0"
"164","18.494589440","151.101.105.91","10.0.2.15","TCP","1354","443  >  40532 [PSH, ACK] Seq=106985 Ack=678 Win=65535 Len=1300 [TCP PDU reassembled in 175]"
"165","18.499553879","151.101.105.91","10.0.2.15","TCP","1354","443  >  40532 [PSH, ACK] Seq=108285 Ack=678 Win=65535 Len=1300 [TCP PDU reassembled in 175]"
"166","18.499580473","10.0.2.15","151.101.105.91","TCP","54","40532  >  443 [ACK] Seq=678 Ack=109585 Win=65535 Len=0"
"167","18.505469374","151.101.105.91","10.0.2.15","TCP","1354","443  >  40532 [PSH, ACK] Seq=109585 Ack=678 Win=65535 Len=1300 [TCP PDU reassembled in 175]"
"168","18.505469694","151.101.105.91","10.0.2.15","TCP","2654","443  >  40532 [PSH, ACK] Seq=110885 Ack=678 Win=65535 Len=2600 [TCP PDU reassembled in 175]"
"169","18.505469716","151.101.105.91","10.0.2.15","TCP","2654","443  >  40532 [PSH, ACK] Seq=113485 Ack=678 Win=65535 Len=2600 [TCP PDU reassembled in 175]"
"170","18.505469737","151.101.105.91","10.0.2.15","TCP","1354","443  >  40532 [PSH, ACK] Seq=116085 Ack=678 Win=65535 Len=1300 [TCP PDU reassembled in 175]"
"171","18.505469761","151.101.105.91","10.0.2.15","TCP","1354","443  >  40532 [PSH, ACK] Seq=117385 Ack=678 Win=65535 Len=1300 [TCP PDU reassembled in 175]"
"172","18.505502581","10.0.2.15","151.101.105.91","TCP","54","40532  >  443 [ACK] Seq=678 Ack=113485 Win=65535 Len=0"
"173","18.505568432","10.0.2.15","151.101.105.91","TCP","54","40532  >  443 [ACK] Seq=678 Ack=116085 Win=65535 Len=0"
"174","18.505613407","10.0.2.15","151.101.105.91","TCP","54","40532  >  443 [ACK] Seq=678 Ack=118685 Win=65535 Len=0"
"175","18.506418952","151.101.105.91","10.0.2.15","TLSv1.2","1354","Application Data"
"176","18.506419233","151.101.105.91","10.0.2.15","TCP","1354","443  >  40532 [PSH, ACK] Seq=119985 Ack=678 Win=65535 Len=1300 [TCP PDU reassembled in 188]"
"177","18.506419255","151.101.105.91","10.0.2.15","TCP","1354","443  >  40532 [PSH, ACK] Seq=121285 Ack=678 Win=65535 Len=1300 [TCP PDU reassembled in 188]"
"178","18.506419276","151.101.105.91","10.0.2.15","TCP","1354","443  >  40532 [PSH, ACK] Seq=122585 Ack=678 Win=65535 Len=1300 [TCP PDU reassembled in 188]"
"179","18.506419318","151.101.105.91","10.0.2.15","TCP","1354","443  >  40532 [PSH, ACK] Seq=123885 Ack=678 Win=65535 Len=1300 [TCP PDU reassembled in 188]"
"180","18.506419335","151.101.105.91","10.0.2.15","TCP","1354","443  >  40532 [PSH, ACK] Seq=125185 Ack=678 Win=65535 Len=1300 [TCP PDU reassembled in 188]"
"181","18.506419356","151.101.105.91","10.0.2.15","TCP","1354","443  >  40532 [PSH, ACK] Seq=126485 Ack=678 Win=65535 Len=1300 [TCP PDU reassembled in 188]"
"182","18.506432450","10.0.2.15","151.101.105.91","TCP","54","40532  >  443 [ACK] Seq=678 Ack=121285 Win=65535 Len=0"
"183","18.507095489","151.101.105.91","10.0.2.15","TCP","1354","443  >  40532 [PSH, ACK] Seq=127785 Ack=678 Win=65535 Len=1300 [TCP PDU reassembled in 188]"
"184","18.507095914","151.101.105.91","10.0.2.15","TCP","1354","443  >  40532 [PSH, ACK] Seq=129085 Ack=678 Win=65535 Len=1300 [TCP PDU reassembled in 188]"
"185","18.507095938","151.101.105.91","10.0.2.15","TCP","1354","443  >  40532 [PSH, ACK] Seq=130385 Ack=678 Win=65535 Len=1300 [TCP PDU reassembled in 188]"
"186","18.507095978","151.101.105.91","10.0.2.15","TCP","1354","443  >  40532 [PSH, ACK] Seq=131685 Ack=678 Win=65535 Len=1300 [TCP PDU reassembled in 188]"
"187","18.507095995","151.101.105.91","10.0.2.15","TCP","1354","443  >  40532 [PSH, ACK] Seq=132985 Ack=678 Win=65535 Len=1300 [TCP PDU reassembled in 188]"
"188","18.507096015","151.101.105.91","10.0.2.15","TLSv1.2","1354","Application Data, Application Data"
"189","18.507256337","10.0.2.15","151.101.105.91","TCP","54","40532  >  443 [ACK] Seq=678 Ack=135585 Win=65535 Len=0"
"190","18.508058188","151.101.105.91","10.0.2.15","TCP","2654","443  >  40532 [PSH, ACK] Seq=135585 Ack=678 Win=65535 Len=2600 [TCP PDU reassembled in 201]"
"191","18.508058593","151.101.105.91","10.0.2.15","TCP","1354","443  >  40532 [PSH, ACK] Seq=138185 Ack=678 Win=65535 Len=1300 [TCP PDU reassembled in 201]"
"192","18.508082054","10.0.2.15","151.101.105.91","TCP","54","40532  >  443 [ACK] Seq=678 Ack=138185 Win=65535 Len=0"
"193","18.511227436","151.101.105.91","10.0.2.15","TCP","1354","443  >  40532 [PSH, ACK] Seq=139485 Ack=678 Win=65535 Len=1300 [TCP PDU reassembled in 201]"
"194","18.511228003","151.101.105.91","10.0.2.15","TCP","2654","443  >  40532 [PSH, ACK] Seq=140785 Ack=678 Win=65535 Len=2600 [TCP PDU reassembled in 201]"
"195","18.511228028","151.101.105.91","10.0.2.15","TCP","1354","443  >  40532 [PSH, ACK] Seq=143385 Ack=678 Win=65535 Len=1300 [TCP PDU reassembled in 201]"
"196","18.511228053","151.101.105.91","10.0.2.15","TCP","1354","443  >  40532 [PSH, ACK] Seq=144685 Ack=678 Win=65535 Len=1300 [TCP PDU reassembled in 201]"
"197","18.511269130","10.0.2.15","151.101.105.91","TCP","54","40532  >  443 [ACK] Seq=678 Ack=140785 Win=65535 Len=0"
"198","18.511667003","151.101.105.91","10.0.2.15","TCP","1354","443  >  40532 [PSH, ACK] Seq=145985 Ack=678 Win=65535 Len=1300 [TCP PDU reassembled in 201]"
"199","18.511667133","151.101.105.91","10.0.2.15","TCP","1354","443  >  40532 [PSH, ACK] Seq=147285 Ack=678 Win=65535 Len=1300 [TCP PDU reassembled in 201]"
"200","18.511787256","10.0.2.15","151.101.105.91","TCP","54","40532  >  443 [ACK] Seq=678 Ack=148585 Win=65535 Len=0"
"201","18.512058036","151.101.105.91","10.0.2.15","TLSv1.2","3954","Application Data"
"202","18.512058202","151.101.105.91","10.0.2.15","TCP","2654","443  >  40532 [PSH, ACK] Seq=152485 Ack=678 Win=65535 Len=2600 [TCP PDU reassembled in 211]"
"203","18.512058242","151.101.105.91","10.0.2.15","TCP","1494","443  >  40532 [ACK] Seq=155085 Ack=678 Win=65535 Len=1440 [TCP PDU reassembled in 211]"
"204","18.512118674","10.0.2.15","151.101.105.91","TCP","54","40532  >  443 [ACK] Seq=678 Ack=156525 Win=65535 Len=0"
"205","18.512444877","151.101.105.91","10.0.2.15","TCP","1214","443  >  40532 [PSH, ACK] Seq=156525 Ack=678 Win=65535 Len=1160 [TCP PDU reassembled in 211]"
"206","18.512849546","151.101.105.91","10.0.2.15","TCP","3954","443  >  40532 [PSH, ACK] Seq=157685 Ack=678 Win=65535 Len=3900 [TCP PDU reassembled in 211]"
"207","18.512849772","151.101.105.91","10.0.2.15","TCP","2654","443  >  40532 [PSH, ACK] Seq=161585 Ack=678 Win=65535 Len=2600 [TCP PDU reassembled in 211]"
"208","18.512849803","151.101.105.91","10.0.2.15","TCP","1354","443  >  40532 [PSH, ACK] Seq=164185 Ack=678 Win=65535 Len=1300 [TCP PDU reassembled in 211]"
"209","18.512860445","10.0.2.15","151.101.105.91","TCP","54","40532  >  443 [ACK] Seq=678 Ack=161585 Win=65535 Len=0"
"210","18.512930734","10.0.2.15","151.101.105.91","TCP","54","40532  >  443 [ACK] Seq=678 Ack=164185 Win=65535 Len=0"
"211","18.513566920","151.101.105.91","10.0.2.15","TLSv1.2","3954","Application Data"
"212","18.513567175","151.101.105.91","10.0.2.15","TCP","1354","443  >  40532 [PSH, ACK] Seq=169385 Ack=678 Win=65535 Len=1300 [TCP PDU reassembled in 223]"
"213","18.513586855","10.0.2.15","151.101.105.91","TCP","54","40532  >  443 [ACK] Seq=678 Ack=169385 Win=65535 Len=0"
"214","18.517434787","151.101.105.91","10.0.2.15","TCP","1354","443  >  40532 [PSH, ACK] Seq=170685 Ack=678 Win=65535 Len=1300 [TCP PDU reassembled in 223]"
"215","18.517435111","151.101.105.91","10.0.2.15","TCP","3954","443  >  40532 [PSH, ACK] Seq=171985 Ack=678 Win=65535 Len=3900 [TCP PDU reassembled in 223]"
"216","18.517435131","151.101.105.91","10.0.2.15","TCP","1354","443  >  40532 [PSH, ACK] Seq=175885 Ack=678 Win=65535 Len=1300 [TCP PDU reassembled in 223]"
"217","18.517435175","151.101.105.91","10.0.2.15","TCP","1354","443  >  40532 [PSH, ACK] Seq=177185 Ack=678 Win=65535 Len=1300 [TCP PDU reassembled in 223]"
"218","18.517435194","151.101.105.91","10.0.2.15","TCP","1354","443  >  40532 [PSH, ACK] Seq=178485 Ack=678 Win=65535 Len=1300 [TCP PDU reassembled in 223]"
"219","18.517465761","10.0.2.15","151.101.105.91","TCP","54","40532  >  443 [ACK] Seq=678 Ack=171985 Win=65535 Len=0"
"220","18.517532270","10.0.2.15","151.101.105.91","TCP","54","40532  >  443 [ACK] Seq=678 Ack=175885 Win=65535 Len=0"
"221","18.517586574","10.0.2.15","151.101.105.91","TCP","54","40532  >  443 [ACK] Seq=678 Ack=178485 Win=65535 Len=0"
"222","18.518417064","151.101.105.91","10.0.2.15","TCP","2654","443  >  40532 [PSH, ACK] Seq=179785 Ack=678 Win=65535 Len=2600 [TCP PDU reassembled in 223]"
"223","18.518417227","151.101.105.91","10.0.2.15","TLSv1.2","2654","Application Data"
"224","18.518417251","151.101.105.91","10.0.2.15","TCP","1354","443  >  40532 [PSH, ACK] Seq=184985 Ack=678 Win=65535 Len=1300 [TCP PDU reassembled in 242]"
"225","18.518417275","151.101.105.91","10.0.2.15","TCP","1354","443  >  40532 [PSH, ACK] Seq=186285 Ack=678 Win=65535 Len=1300 [TCP PDU reassembled in 242]"
"226","18.518417317","151.101.105.91","10.0.2.15","TCP","1354","443  >  40532 [PSH, ACK] Seq=187585 Ack=678 Win=65535 Len=1300 [TCP PDU reassembled in 242]"
"227","18.518433671","10.0.2.15","151.101.105.91","TCP","54","40532  >  443 [ACK] Seq=678 Ack=182385 Win=65535 Len=0"
"228","18.518489405","10.0.2.15","151.101.105.91","TCP","54","40532  >  443 [ACK] Seq=678 Ack=184985 Win=65535 Len=0"
"229","18.518536559","10.0.2.15","151.101.105.91","TCP","54","40532  >  443 [ACK] Seq=678 Ack=187585 Win=65535 Len=0"
"230","18.519099542","151.101.105.91","10.0.2.15","TCP","1354","443  >  40532 [PSH, ACK] Seq=188885 Ack=678 Win=65535 Len=1300 [TCP PDU reassembled in 242]"
"231","18.519099705","151.101.105.91","10.0.2.15","TCP","1354","443  >  40532 [PSH, ACK] Seq=190185 Ack=678 Win=65535 Len=1300 [TCP PDU reassembled in 242]"
"232","18.519099730","151.101.105.91","10.0.2.15","TCP","1354","443  >  40532 [PSH, ACK] Seq=191485 Ack=678 Win=65535 Len=1300 [TCP PDU reassembled in 242]"
"233","18.519099773","151.101.105.91","10.0.2.15","TCP","1354","443  >  40532 [PSH, ACK] Seq=192785 Ack=678 Win=65535 Len=1300 [TCP PDU reassembled in 242]"
"234","18.519099794","151.101.105.91","10.0.2.15","TCP","1354","443  >  40532 [PSH, ACK] Seq=194085 Ack=678 Win=65535 Len=1300 [TCP PDU reassembled in 242]"
"235","18.519108591","10.0.2.15","151.101.105.91","TCP","54","40532  >  443 [ACK] Seq=678 Ack=190185 Win=65535 Len=0"
"236","18.519181830","10.0.2.15","151.101.105.91","TCP","54","40532  >  443 [ACK] Seq=678 Ack=192785 Win=65535 Len=0"
"237","18.519227827","10.0.2.15","151.101.105.91","TCP","54","40532  >  443 [ACK] Seq=678 Ack=195385 Win=65535 Len=0"
"238","18.519909486","151.101.105.91","10.0.2.15","TCP","1354","443  >  40532 [PSH, ACK] Seq=195385 Ack=678 Win=65535 Len=1300 [TCP PDU reassembled in 242]"
"239","18.519909648","151.101.105.91","10.0.2.15","TCP","1354","443  >  40532 [PSH, ACK] Seq=196685 Ack=678 Win=65535 Len=1300 [TCP PDU reassembled in 242]"
"240","18.519909669","151.101.105.91","10.0.2.15","TCP","1354","443  >  40532 [PSH, ACK] Seq=197985 Ack=678 Win=65535 Len=1300 [TCP PDU reassembled in 242]"
"241","18.519909712","151.101.105.91","10.0.2.15","TCP","1354","443  >  40532 [PSH, ACK] Seq=199285 Ack=678 Win=65535 Len=1300 [TCP PDU reassembled in 242]"
"242","18.519909732","151.101.105.91","10.0.2.15","TLSv1.2","1354","Application Data, Application Data"
"243","18.519909759","151.101.105.91","10.0.2.15","TCP","1354","443  >  40532 [PSH, ACK] Seq=201885 Ack=678 Win=65535 Len=1300 [TCP PDU reassembled in 262]"
"244","18.519909779","151.101.105.91","10.0.2.15","TCP","1354","443  >  40532 [PSH, ACK] Seq=203185 Ack=678 Win=65535 Len=1300 [TCP PDU reassembled in 262]"
"245","18.519920701","10.0.2.15","151.101.105.91","TCP","54","40532  >  443 [ACK] Seq=678 Ack=197985 Win=65535 Len=0"
"246","18.519972963","10.0.2.15","151.101.105.91","TCP","54","40532  >  443 [ACK] Seq=678 Ack=200585 Win=65535 Len=0"
"247","18.520014890","10.0.2.15","151.101.105.91","TCP","54","40532  >  443 [ACK] Seq=678 Ack=203185 Win=65535 Len=0"
"248","18.520784915","151.101.105.91","10.0.2.15","TCP","1354","443  >  40532 [PSH, ACK] Seq=204485 Ack=678 Win=65535 Len=1300 [TCP PDU reassembled in 262]"
"249","18.520785091","151.101.105.91","10.0.2.15","TCP","1354","443  >  40532 [PSH, ACK] Seq=205785 Ack=678 Win=65535 Len=1300 [TCP PDU reassembled in 262]"
"250","18.520785124","151.101.105.91","10.0.2.15","TCP","1354","443  >  40532 [PSH, ACK] Seq=207085 Ack=678 Win=65535 Len=1300 [TCP PDU reassembled in 262]"
"251","18.520785144","151.101.105.91","10.0.2.15","TCP","1354","443  >  40532 [PSH, ACK] Seq=208385 Ack=678 Win=65535 Len=1300 [TCP PDU reassembled in 262]"
"252","18.520785164","151.101.105.91","10.0.2.15","TCP","1354","443  >  40532 [PSH, ACK] Seq=209685 Ack=678 Win=65535 Len=1300 [TCP PDU reassembled in 262]"
"253","18.520785188","151.101.105.91","10.0.2.15","TCP","1354","443  >  40532 [PSH, ACK] Seq=210985 Ack=678 Win=65535 Len=1300 [TCP PDU reassembled in 262]"
"254","18.520785207","151.101.105.91","10.0.2.15","TCP","1354","443  >  40532 [PSH, ACK] Seq=212285 Ack=678 Win=65535 Len=1300 [TCP PDU reassembled in 262]"
"255","18.520794002","10.0.2.15","151.101.105.91","TCP","54","40532  >  443 [ACK] Seq=678 Ack=205785 Win=65535 Len=0"
"256","18.520844198","10.0.2.15","151.101.105.91","TCP","54","40532  >  443 [ACK] Seq=678 Ack=208385 Win=65535 Len=0"
"257","18.520897781","10.0.2.15","151.101.105.91","TCP","54","40532  >  443 [ACK] Seq=678 Ack=210985 Win=65535 Len=0"
"258","18.520941740","10.0.2.15","151.101.105.91","TCP","54","40532  >  443 [ACK] Seq=678 Ack=213585 Win=65535 Len=0"
"259","18.521496693","151.101.105.91","10.0.2.15","TCP","1354","443  >  40532 [PSH, ACK] Seq=213585 Ack=678 Win=65535 Len=1300 [TCP PDU reassembled in 262]"
"260","18.521496843","151.101.105.91","10.0.2.15","TCP","1354","443  >  40532 [PSH, ACK] Seq=214885 Ack=678 Win=65535 Len=1300 [TCP PDU reassembled in 262]"
"261","18.521496877","151.101.105.91","10.0.2.15","TCP","1354","443  >  40532 [PSH, ACK] Seq=216185 Ack=678 Win=65535 Len=1300 [TCP PDU reassembled in 262]"
"262","18.521496901","151.101.105.91","10.0.2.15","TLSv1.2","1354","Application Data"
"263","18.521496922","151.101.105.91","10.0.2.15","TCP","1354","443  >  40532 [PSH, ACK] Seq=218785 Ack=678 Win=65535 Len=1300 [TCP PDU reassembled in 277]"
"264","18.521516225","10.0.2.15","151.101.105.91","TCP","54","40532  >  443 [ACK] Seq=678 Ack=216185 Win=65535 Len=0"
"265","18.521578466","10.0.2.15","151.101.105.91","TCP","54","40532  >  443 [ACK] Seq=678 Ack=218785 Win=65535 Len=0"
"266","18.523260523","151.101.105.91","10.0.2.15","TCP","1354","443  >  40532 [PSH, ACK] Seq=220085 Ack=678 Win=65535 Len=1300 [TCP PDU reassembled in 277]"
"267","18.523260688","151.101.105.91","10.0.2.15","TCP","5254","443  >  40532 [PSH, ACK] Seq=221385 Ack=678 Win=65535 Len=5200 [TCP PDU reassembled in 277]"
"268","18.523260715","151.101.105.91","10.0.2.15","TCP","1354","443  >  40532 [PSH, ACK] Seq=226585 Ack=678 Win=65535 Len=1300 [TCP PDU reassembled in 277]"
"269","18.523260753","151.101.105.91","10.0.2.15","TCP","1354","443  >  40532 [PSH, ACK] Seq=227885 Ack=678 Win=65535 Len=1300 [TCP PDU reassembled in 277]"
"270","18.523286076","10.0.2.15","151.101.105.91","TCP","54","40532  >  443 [ACK] Seq=678 Ack=221385 Win=65535 Len=0"
"271","18.523339520","10.0.2.15","151.101.105.91","TCP","54","40532  >  443 [ACK] Seq=678 Ack=226585 Win=65535 Len=0"
"272","18.523383399","10.0.2.15","151.101.105.91","TCP","54","40532  >  443 [ACK] Seq=678 Ack=229185 Win=65535 Len=0"
"273","18.523774097","151.101.105.91","10.0.2.15","TCP","1354","443  >  40532 [PSH, ACK] Seq=229185 Ack=678 Win=65535 Len=1300 [TCP PDU reassembled in 277]"
"274","18.523774238","151.101.105.91","10.0.2.15","TCP","1354","443  >  40532 [PSH, ACK] Seq=230485 Ack=678 Win=65535 Len=1300 [TCP PDU reassembled in 277]"
"275","18.523774262","151.101.105.91","10.0.2.15","TCP","1354","443  >  40532 [PSH, ACK] Seq=231785 Ack=678 Win=65535 Len=1300 [TCP PDU reassembled in 277]"
"276","18.523788885","10.0.2.15","151.101.105.91","TCP","54","40532  >  443 [ACK] Seq=678 Ack=231785 Win=65535 Len=0"
"277","18.536579094","151.101.105.91","10.0.2.15","TLSv1.2","1354","Application Data"
"278","18.536579415","151.101.105.91","10.0.2.15","TCP","3470","443  >  40532 [PSH, ACK] Seq=234385 Ack=678 Win=65535 Len=3416 [TCP PDU reassembled in 291]"
"279","18.536622264","10.0.2.15","151.101.105.91","TCP","54","40532  >  443 [ACK] Seq=678 Ack=234385 Win=65535 Len=0"
"280","18.536694930","10.0.2.15","151.101.105.91","TCP","54","40532  >  443 [ACK] Seq=678 Ack=237801 Win=65535 Len=0"
"281","18.545362395","151.101.105.91","10.0.2.15","TCP","1354","443  >  40532 [PSH, ACK] Seq=237801 Ack=678 Win=65535 Len=1300 [TCP PDU reassembled in 291]"
"282","18.545362671","151.101.105.91","10.0.2.15","TCP","2654","443  >  40532 [PSH, ACK] Seq=239101 Ack=678 Win=65535 Len=2600 [TCP PDU reassembled in 291]"
"283","18.545362710","151.101.105.91","10.0.2.15","TCP","2654","443  >  40532 [PSH, ACK] Seq=241701 Ack=678 Win=65535 Len=2600 [TCP PDU reassembled in 291]"
"284","18.545362731","151.101.105.91","10.0.2.15","TCP","1354","443  >  40532 [PSH, ACK] Seq=244301 Ack=678 Win=65535 Len=1300 [TCP PDU reassembled in 291]"
"285","18.545362750","151.101.105.91","10.0.2.15","TCP","1354","443  >  40532 [PSH, ACK] Seq=245601 Ack=678 Win=65535 Len=1300 [TCP PDU reassembled in 291]"
"286","18.545398358","10.0.2.15","151.101.105.91","TCP","54","40532  >  443 [ACK] Seq=678 Ack=241701 Win=65535 Len=0"
"287","18.545463849","10.0.2.15","151.101.105.91","TCP","54","40532  >  443 [ACK] Seq=678 Ack=244301 Win=65535 Len=0"
"288","18.545508578","10.0.2.15","151.101.105.91","TCP","54","40532  >  443 [ACK] Seq=678 Ack=246901 Win=65535 Len=0"
"289","18.546152385","151.101.105.91","10.0.2.15","TCP","1354","443  >  40532 [PSH, ACK] Seq=246901 Ack=678 Win=65535 Len=1300 [TCP PDU reassembled in 291]"
"290","18.546152724","151.101.105.91","10.0.2.15","TCP","1354","443  >  40532 [PSH, ACK] Seq=248201 Ack=678 Win=65535 Len=1300 [TCP PDU reassembled in 291]"
"291","18.546152749","151.101.105.91","10.0.2.15","TLSv1.2","1354","Application Data"
"292","18.546152772","151.101.105.91","10.0.2.15","TCP","1354","443  >  40532 [PSH, ACK] Seq=250801 Ack=678 Win=65535 Len=1300 [TCP PDU reassembled in 305]"
"293","18.546152793","151.101.105.91","10.0.2.15","TCP","1354","443  >  40532 [PSH, ACK] Seq=252101 Ack=678 Win=65535 Len=1300 [TCP PDU reassembled in 305]"
"294","18.546333984","10.0.2.15","151.101.105.91","TCP","54","40532  >  443 [ACK] Seq=678 Ack=249501 Win=65535 Len=0"
"295","18.546390492","10.0.2.15","151.101.105.91","TCP","54","40532  >  443 [ACK] Seq=678 Ack=252101 Win=65535 Len=0"
"296","18.546889427","151.101.105.91","10.0.2.15","TCP","1354","443  >  40532 [PSH, ACK] Seq=253401 Ack=678 Win=65535 Len=1300 [TCP PDU reassembled in 305]"
"297","18.546889805","151.101.105.91","10.0.2.15","TCP","1354","443  >  40532 [PSH, ACK] Seq=254701 Ack=678 Win=65535 Len=1300 [TCP PDU reassembled in 305]"
"298","18.546889829","151.101.105.91","10.0.2.15","TCP","1354","443  >  40532 [PSH, ACK] Seq=256001 Ack=678 Win=65535 Len=1300 [TCP PDU reassembled in 305]"
"299","18.546889867","151.101.105.91","10.0.2.15","TCP","1354","443  >  40532 [PSH, ACK] Seq=257301 Ack=678 Win=65535 Len=1300 [TCP PDU reassembled in 305]"
"300","18.546896727","10.0.2.15","151.101.105.91","TCP","54","40532  >  443 [ACK] Seq=678 Ack=254701 Win=65535 Len=0"
"301","18.546950856","10.0.2.15","151.101.105.91","TCP","54","40532  >  443 [ACK] Seq=678 Ack=257301 Win=65535 Len=0"
"302","18.551689096","151.101.105.91","10.0.2.15","TCP","1354","443  >  40532 [PSH, ACK] Seq=258601 Ack=678 Win=65535 Len=1300 [TCP PDU reassembled in 305]"
